{
  "provider": "llamacpp",
  "enabled": false,
  "lane": "remote_host",
  "host": "Inference box",
  "transport": "tailscale",
  "model": null,
  "baseUrl": "http://TAILNET_HOST:8080/v1",
  "apiKeyEnv": "LLAMACPP_API_KEY",
  "displayName": "Remote llama.cpp",
  "tags": ["remote_host", "llamacpp"]
}
